<!ELEMENT pedidos (pedido*)>
<!ELEMENT pedido (codigo, cantidad, peso?)>
<!ELEMENT codigo (#PCDATA)>
<!ELEMENT cantidad (#PCDATA)>
<!ELEMENT peso (#PCDATA)>
